{"key_id":"ed25519:a574dd0fee97965ad65b6777d3efe137","payload":{"anchor_provider_id":"anchor.p3.acceptance","anchor_provider_key_id":"ed25519:cdad8d031374653b7c1489feaf39c4ef","anchor_receipt_id":"anchor.095f5d407cb768340fd52b065cba56e6","anchor_statement_sha256":"eb96857e35e64e68c949fda668fdee8a5d68cadf3b1b901f97fc40b19301ef72","environment_identity_digest":"2222222222222222222222222222222222222222222222222222222222222222","evidence_merkle_root":"8d62ac0cb34e022d4cad0073aa02c89d2fe2707c0680774a2214604673a8b88f","expires_at":"2026-08-15T08:55:50.300026Z","issued_at":"2026-07-16T08:57:50.300026Z","lifecycle_state":"VALID","mandatory_rule_results_digest":"f1ba0bc68a96e8097511ac6f7065f168e11b53d4f39a876e9a971f606b1207b8","mandatory_rules_digest":"4444444444444444444444444444444444444444444444444444444444444444","policy_digest":"3333333333333333333333333333333333333333333333333333333333333333","policy_version":"policy.v1","release_verdict":"PRODUCTION_READY","request_id":"sign.p3.acceptance.1","run_id":"run.p3.acceptance","run_outcome":"COMPLETE","schema_version":"2.0.0","signing_algorithm":"Ed25519","signing_key_id":"ed25519:a574dd0fee97965ad65b6777d3efe137","target_identity_digest":"1111111111111111111111111111111111111111111111111111111111111111","tenant_id":"tenant.p3.acceptance"},"public_key_pem":"-----BEGIN PUBLIC KEY-----\nMCowBQYDK2VwAyEAlG0Rw8TcbNnOyDnGPhOTBri6soqAiSlXCmp7pfPpyzE=\n-----END PUBLIC KEY-----\n","signature_b64":"hAG/qPy6p8IfSvjtT+O6kERqqZLAxXh9oOZFtXqUAtFP0R7dC9UrczRVVTDV8C24486P4C5WnhNyr4pTEMdKCg=="}
